{
  "action": "new_permissions_accepted",
  "installation": {
    "id": 957387,
    "account": {
      "login": "Codertocat",
      "id": 21031067,
      "node_id": "MDQ6VXNlcjIxMDMxMDY3",
      "avatar_url": "https://avatars1.githubusercontent.com/u/21031067?v=4",
      "gravatar_id": "",
      "url": "https://api.github.com/users/Codertocat",
      "html_url": "https://github.com/Codertocat",
      "followers_url": "https://api.github.com/users/Codertocat/followers",
      "following_url": "https://api.github.com/users/Codertocat/following{/other_user}",
      "gists_url": "https://api.github.com/users/Codertocat/gists{/gist_id}",
      "starred_url": "https://api.github.com/users/Codertocat/starred{/owner}{/repo}",
      "subscriptions_url": "https://api.github.com/users/Codertocat/subscriptions",
      "organizations_url": "https://api.github.com/users/Codertocat/orgs",
      "repos_url": "https://api.github.com/users/Codertocat/repos",
      "events_url": "https://api.github.com/users/Codertocat/events{/privacy}",
      "received_events_url": "https://api.github.com/users/Codertocat/received_events",
      "type": "User",
      "site_admin": false
    },
    "repository_selection": "all",
    "access_tokens_url": "https://api.github.com/app/installations/957387/access_tokens",
    "repositories_url": "https://api.github.com/installation/repositories",
    "html_url": "https://github.com/settings/installations/957387",
    "app_id": 29310,
    "app_slug": "",
    "target_id": 21031067,
    "target_type": "Organization",
    "permissions": {
      "administration": "write",
      "checks": "write",
      "contents": "write",
      "deployments": "write",
      "issues": "write",
      "pages": "write",
      "pull_requests": "write",
      "repository_hooks": "write",
      "repository_projects": "write",
      "statuses": "write",
      "metadata": "read",
      "vulnerability_alerts": "read"
    },
    "events": [
      "check_run",
      "check_suite",
      "commit_comment",
      "create",
      "delete",
      "deployment",
      "deployment_review",
      "deployment_status",
      "deploy_key",
      "fork",
      "issues",
      "issue_comment",
      "label",
      "member",
      "membership",
      "milestone",
      "organization",
      "project",
      "project_card",
      "project_column",
      "public",
      "pull_request",
      "pull_request_review",
      "pull_request_review_comment",
      "push",
      "release",
      "repository",
      "repository_dispatch",
      "star",
      "status",
      "team",
      "team_add",
      "watch",
      "workflow_dispatch",
      "workflow_run"
    ],
    "created_at": 1557933591,
    "updated_at": 1557933591,
    "single_file_name": null,
    "has_multiple_single_files": false,
    "single_file_paths": [],
    "suspended_by": null,
    "suspended_at": null
  },
  "repositories": [
    {
      "id": 186853002,
      "node_id": "MDEwOlJlcG9zaXRvcnkxODY4NTMwMDI=",
      "name": "Hello-World",
      "full_name": "Codertocat/Hello-World",
      "private": false
    }
  ],
  "sender": {
    "login": "Codertocat",
    "id": 21031067,
    "node_id": "MDQ6VXNlcjIxMDMxMDY3",
    "avatar_url": "https://avatars1.githubusercontent.com/u/21031067?v=4",
    "gravatar_id": "",
    "url": "https://api.github.com/users/Codertocat",
    "html_url": "https://github.com/Codertocat",
    "followers_url": "https://api.github.com/users/Codertocat/followers",
    "following_url": "https://api.github.com/users/Codertocat/following{/other_user}",
    "gists_url": "https://api.github.com/users/Codertocat/gists{/gist_id}",
    "starred_url": "https://api.github.com/users/Codertocat/starred{/owner}{/repo}",
    "subscriptions_url": "https://api.github.com/users/Codertocat/subscriptions",
    "organizations_url": "https://api.github.com/users/Codertocat/orgs",
    "repos_url": "https://api.github.com/users/Codertocat/repos",
    "events_url": "https://api.github.com/users/Codertocat/events{/privacy}",
    "received_events_url": "https://api.github.com/users/Codertocat/received_events",
    "type": "User",
    "site_admin": false
  }
}
